[
    {
        "Name": "古树",
        "EnterMap": "SceneEnterWorldWulingJingyuValley7",
        "MapName": "map02_lv001",
        "MapTarget": [280, 580, 15, 15],
        "MapPath": [
            [288, 587],
            [296, 577],
            [301, 572],
            [303, 565],
            [303, 552],
            [306, 545],
            [315, 542],
            [329, 540],
            [339, 541],
            [345, 536],
            [356, 534],
            [368, 531],
            [374, 539],
            [369, 547],
            [368, 556],
            [363, 564],
            [355, 570]
        ],
        "CameraSwipeDirection": "EnvironmentMonitoringSwipeScreenUp"
    },
    {
        "Name": "侵蚀潮中损坏的信标",
        "EnterMap": "SceneEnterWorldWulingWulingCity0",
        "MapName": "map02_lv002",
        "MapTarget": [640, 255, 15, 15],
        "MapPath": [
            [641, 272],
            [639, 299],
            [628, 301],
            [623, 302],
            [641, 317],
            [648, 317],
            [685, 318],
            [686, 329],
            [680, 333],
            [691, 344],
            [701, 345]
        ],
        "CameraSwipeDirection": "EnvironmentMonitoringSwipeScreenDown"
    },
    {
        "Name": "蓄水源石虫",
        "EnterMap": "SceneEnterWorldWulingJingyuValley7",
        "MapName": "map02_lv001",
        "MapTarget": [280, 580, 15, 15],
        "MapPath": [
            [291, 582],
            [298, 576],
            [306, 578],
            [309, 593],
            [318, 593]
        ],
        "CameraSwipeDirection": "EnvironmentMonitoringSwipeScreenRight"
    },
    {
        "Name": "漱玉",
        "EnterMap": "SceneEnterWorldWulingJingyuValley4",
        "MapName": "map02_lv001",
        "MapTarget": [255, 395, 15, 15],
        "MapPath": [[246, 394]],
        "CameraSwipeDirection": "EnvironmentMonitoringSwipeScreenUp"
    },
    {
        "Name": "倒塌的天师桩",
        "EnterMap": "SceneEnterWorldWulingJingyuValley8",
        "MapName": "map02_lv001",
        "MapTarget": [210, 635, 15, 15],
        "MapPath": [
            [213, 632],
            [191, 616],
            [186, 621],
            [180, 618]
        ],
        "CameraSwipeDirection": "EnvironmentMonitoringSwipeScreenUp"
    },
    {
        "Name": "栖霞驻影",
        "EnterMap": "SceneEnterWorldWulingJingyuValley2",
        "MapName": "map02_lv001",
        "MapTarget": [315, 305, 15, 15],
        "MapPath": [
            [332, 303],
            [346, 296]
        ],
        "CameraSwipeDirection": "EnvironmentMonitoringSwipeScreenUp"
    },
    {
        "Name": "室内作物",
        "EnterMap": "SceneEnterWorldWulingWulingCity4",
        "MapName": "map02_lv002",
        "MapTarget": [240, 695, 15, 15],
        "MapPath": [
            [237, 703],
            [219, 705],
            [214, 716],
            [211, 727],
            [198, 729],
            [195, 721],
            [187, 721],
            [190, 729]
        ],
        "CameraSwipeDirection": "EnvironmentMonitoringSwipeScreenUp"
    },
    {
        "Name": "七彩鳞",
        "EnterMap": "SceneEnterWorldWulingJingyuValley10",
        "MapName": "map02_lv001",
        "MapTarget": [125, 815, 15, 15],
        "MapPath": [
            [131, 820],
            [142, 818],
            [151, 813],
            [163, 808],
            [172, 799],
            [188, 789],
            [194, 765],
            [205, 755]
        ],
        "CameraSwipeDirection": "EnvironmentMonitoringSwipeScreenDown"
    },
    {
        "Name": "储备站周围的生态环境",
        "EnterMap": "SceneEnterWorldWulingWulingCity8",
        "MapName": "map02_lv002",
        "MapTarget": [689.6, 917.3, 6.0, 5.5],
        "MapPath": [
            [691.3, 922.7],
            [678.3, 925.9],
            [672.5, 918.3],
            [648.4, 916.3],
            [648.7, 928.2],
            [653.1, 931.8],
            [666.8, 907.8],
            [664.6, 897.7],
            [661.4, 892.6],
            [627.7, 898.2],
            [617.8, 901.6]
        ],
        "CameraSwipeDirection": "EnvironmentMonitoringSwipeScreenLeft"
    },
    {
        "Name": "肚子鼓气后发光的吐虫长股兽",
        "EnterMap": "SceneEnterWorldWulingWulingCity7",
        "MapName": "map02_lv002",
        "MapTarget": [416.7, 844.3, 11.4, 10.6],
        "MapPath": [
            [425.0, 851.2],
            [436.3, 842.5]
        ],
        "CameraSwipeDirection": "EnvironmentMonitoringSwipeScreenUp"
    },
    {
        "Name": "东张西望的黑腹雉羽兽",
        "EnterMap": "SceneEnterWorldWulingJingyuValley0",
        "MapName": "map02_lv001",
        "MapTarget": [342.2, 124.2, 4, 4],
        "MapPath": [
            [349.9, 128.0],
            [373.3, 135.6]
        ],
        "CameraSwipeDirection": "EnvironmentMonitoringSwipeScreenDown"
    },
    {
        "Name": "充满活力的蓄水源石虫",
        "EnterMap": "SceneEnterWorldWulingJingyuValley8",
        "MapName": "map02_lv001",
        "MapTarget": [210, 635, 15, 15],
        "MapPath": [
            [213.0, 632.0],
            [216.0, 630.4]
        ],
        "CameraSwipeDirection": "EnvironmentMonitoringSwipeScreenRight"
    },
    {
        "Name": "水灯虫",
        "EnterMap": "SceneEnterWorldWulingWulingCity7",
        "MapName": "map02_lv002",
        "MapTarget": [420.3, 848.0, 10.3, 8.9],
        "MapPath": [[428.3, 844.0]],
        "CameraSwipeDirection": "EnvironmentMonitoringSwipeScreenUp"
    },
    {
        "Name": "枢壤仪",
        "EnterMap": "SceneEnterWorldWulingWulingCity4",
        "MapName": "map02_lv002",
        "MapTarget": [240, 695, 15, 15],
        "MapPath": [
            [241.3, 703.6],
            [215.2, 703.7],
            [213.6, 693.7],
            [195.1, 680.2],
            [183.7, 680.2],
            [177.6, 675.2],
            [170.8, 674.6]
        ],
        "CameraSwipeDirection": "EnvironmentMonitoringSwipeScreenUp"
    },
    {
        "Name": "码头水车",
        "EnterMap": "SceneEnterWorldWulingJingyuValley1",
        "MapName": "map02_lv001",
        "MapTarget": [492.5, 178.0, 13.2, 13.0],
        "MapPath": [
            [504.6, 189.0],
            [512.0, 192.0]
        ],
        "CameraSwipeDirection": "EnvironmentMonitoringSwipeScreenUp"
    },
    {
        "Name": "小壳兽",
        "EnterMap": "SceneEnterWorldWulingWulingCity4",
        "MapName": "map02_lv002",
        "MapTarget": [238.6, 694.1, 15.2, 14.6],
        "MapPath": [
            [239.8, 704.8],
            [214.7, 706.1],
            [216.1, 702.7]
        ],
        "CameraSwipeDirection": "EnvironmentMonitoringSwipeScreenDown"
    },
    {
        "Name": "环形瀑布",
        "EnterMap": "SceneEnterWorldWulingQingboStockade3",
        "MapName": "map02_lv003",
        "MapTarget": [502.2, 360.2, 13.2, 13.9],
        "MapPath": [
            [498.8, 360.5],
            [501.1, 347.9],
            [506.4, 334.0],
            [507.4, 330.5]
        ],
        "CameraSwipeDirection": "EnvironmentMonitoringSwipeScreenUp"
    },
    {
        "Name": "水竹铃",
        "EnterMap": "SceneEnterWorldWulingQingboStockade1",
        "MapName": "map02_lv003",
        "MapTarget": [300, 460, 15, 15],
        "MapPath": [
            [291.7, 473.5],
            [269.9, 474.2],
            [269.6, 464.1],
            [268.8, 458.1]
        ],
        "CameraSwipeDirection": "EnvironmentMonitoringSwipeScreenLeft"
    },
    {
        "Name": "枯枝",
        "EnterMap": "SceneEnterWorldWulingQingboStockade3",
        "MapName": "map02_lv003",
        "MapTarget": [502.2, 360.2, 13.2, 13.9],
        "MapPath": [
            [506.3, 378.0],
            [507.5, 379.2]
        ],
        "CameraSwipeDirection": "EnvironmentMonitoringSwipeScreenUp"
    },
    {
        "Name": "谜之生物的涂鸦",
        "EnterMap": "SceneEnterWorldWulingQingboStockade2",
        "MapName": "map02_lv003",
        "MapTarget": [384.5, 542.0, 28.0, 28.0],
        "MapPath": [
            [407.4, 548.1],
            [420.8, 537.6],
            [434.6, 527.3],
            [438.2, 523.6],
            [437.4, 519.3],
            [435.2, 515.8],
            [435.0, 505.6],
            [436.2, 503.6],
            [438.8, 503.1],
            [441.3, 503.1],
            [442.5, 508.0],
            [445.0, 513.0],
            [445.1, 519.3],
            [442.5, 525.4],
            [441.3, 528.0],
            [442.5, 531.7]
        ],
        "CameraSwipeDirection": "EnvironmentMonitoringSwipeScreenLeft"
    },
    {
        "Name": "“旧庭树”",
        "EnterMap": "SceneEnterWorldWulingMarkerStone1",
        "MapName": "map02_lv004",
        "MapTarget": [491.2, 197.9, 11.7, 10.7],
        "MapPath": [
            [500.0, 211.0],
            [520.8, 211.2],
            [520.8, 196.3],
            [538.3, 195.1],
            [539.4, 178.7],
            [555.8, 177.5],
            [555.8, 178.8]
        ],
        "CameraSwipeDirection": "EnvironmentMonitoringSwipeScreenDown"
    },
    {
        "Name": "垂藤",
        "EnterMap": "SceneEnterWorldWulingMarkerStone3",
        "MapName": "map02_lv004",
        "MapTarget": [602.8, 325.0, 9.7, 8.1],
        "MapPath": [
            [604.6, 307.8],
            [587.6, 308.6],
            [586.3, 302.6],
            [578.8, 302.4],
            [576.7, 296.5],
            [575.2, 280.9],
            [546.2, 279.8],
            [531.2, 279.7],
            [528.8, 278.6],
            [527.5, 278.6],
            [527.5, 268.5],
            [534.5, 267.5],
            [543.3, 267.4],
            [543.3, 265.1],
            [544.4, 263.8],
            [544.6, 255.1],
            [545.7, 253.8],
            [545.7, 252.5],
            [555.8, 252.6],
            [558.2, 253.7],
            [579.5, 253.7]
        ],
        "CameraSwipeDirection": "EnvironmentMonitoringSwipeScreenUp",
        "CameraMaxHit": 4
    },
    {
        "Name": "植物观察点",
        "EnterMap": "SceneEnterWorldWulingMarkerStone3",
        "MapName": "map02_lv004",
        "MapTarget": [602.8, 325.0, 9.7, 8.1],
        "MapPath": [
            [606.3, 322.3],
            [606.2, 313.5],